5233682	How to Make Yakiniku Sauce to Grill Meat in the Japanese Food. Yakiniku is one of way to cook in the Japanese food. That is mean, cooking grilled meat or roasted meat on the ember or griller. Yakiniku are included variety dish like meat, pork, innards, beef steak, lamb, and barbeque with dipper sauce. One of ingredient to make yakiniku sauce is mirin. Mirin is Japanese ingredient to cook just like making teriyaki sauce. Which it content alcohol 14%, and sugar 40 – 50%. You can find mirin in the Japanese store.

5233683	The simplest way to prepare beef yakiniku is to simply season strips of good-quality beef with salt and pepper as they cook. When they’re done to your taste, you can eat them as they are or dip them in sauces like teriyaki sauce or ponzu.

4491796	Meet Melania Trump, a new model for first lady. Melania Trump finds herself directly in the 2016 U.S. presidential campaign spotlight. Melania Trump has rarely accompanied Donald Trump lately as he criss-crosses the country campaigning to be president. Before she met Donald Trump at the Kit Kat Club in Manhattan and stepped into a glitzy world of limos and penthouses, diamonds and caviar, Melania Knauss lived quietly.

1490466	Research locations. With a food truck, you can travel to new locations and develop multiple customer bases. You should research prime selling spots, such as business parks, farmer’s markets or roaming food truck events. Zoning regulations and other restrictions may limit your options, however.

4464163	Benefits of a Vegan Lifestyle. Every year more and more people are making the decision to go vegan, and for good reason! There are so many amazing ways that veganism can improve our lives – fantastic health benefits, less stress on our environment, more efficient ways to use our resources, and many more!

7240228	Of course you do not have to limit yourself to Japanese food. Tokyo is one of the best places (if not the best) to eat in the world. In most Italian restaurants (even if it calls itself a pasta house or pizzeria), you can find more than one non-pasta and non-pizza dish (although for economic reasons, that may not be the case at lunch; but certainly at dinner).

7632930	electronic discovery (e-discovery or ediscovery) Electronic discovery (also called e-discovery or ediscovery) refers to any process in which electronic data is sought, located, secured, and searched with the intent of using it as evidence in a civil or criminal legal case. E-discovery can be carried out offline on a particular computer or it can be done in a network.

3215398	First Lady Michelle Obama. The first lady of the United States is not elected, has no constitutional duties and receives no salary, but that doesn’t mean the position is without its privileges – including a staff of 22 White House employees who make a combined nearly $1.5 million per year.

5028906	Diana Taliun/iStock/Getty Images. Honey doesn't spoil like other foods and even if it has turned cloudy, it's still safe to eat. While you may be used to seeing clear, golden honey, cloudy honey is normal and natural.Clouding is caused by crystallization of the sugars and doesn't affect the taste or safety of the honey and is reversible.If the honey is in a jar, you can warm it on the stove. It doesn't harm honey to store it in the refrigerator, but it isn't necessary and will make honey cloudy and, sometimes, develop graininess as it crystallizes. 2  You can also warm honey in the microwave, as long as it is in a microwave-safe container and you use your microwave's lowest setting.

1328173	Puget Sound skiers and riders flock to the slopes during the winter months to enjoy breath-taking views of Mt. Rainier and to ride some of the best terrain in Washington State, only 2 hours away from Seattle in the heart of the Cascade Mountains.

3730990	George Zimmerman auctioning off gun used to kill Trayvon Martin. George Zimmerman is trying to sell the gun he killed unarmed teenager Trayvon Martin with. Zimmerman shot Martin in 2012, but was later acquitted on the basis of self-defense. Mark Strassmann has more.

3537980	The Venus flytrap (also referred to as Venus's flytrap or Venus' flytrap), Dionaea muscipula, is a carnivorous plant native to subtropical wetlands on the East Coast of the United States in North Carolina and South Carolina.escription. The Venus flytrap is a small plant whose structure can be described as a rosette of four to seven leaves, which arise from a short subterranean stem that is actually a bulb-like object.

6108225	As for repairing a chipped tooth, your dentist can usually fix minor chips with modern bonding techniques using tooth-colored filling materials. For larger chips that involve more tooth structure, your dentist may suggest a crown (cap) or a veneer. The most important thing to remember is that if you chip a tooth, you need to see a dental professional for a proper evaluation and treatment remedy. Learn more about Repairing Chipped Teeth.

4364866	Meat production requires a much higher amount of water than vegetables. IME state that to produce 1kg of meat requires between 5,000 and 20,000 litres of water whereas to produce 1kg of wheat requires between 500 and 4,000 litres of water. The table below shows typical values for the volume of water required to produce common foodstuffs.

3678275	When you have high cholesterol, the first thing to do is to change your diet and fitness: less saturated fat, no trans fat, and more activity. If that doesn’t bring down your “bad” (LDL) cholesterol enough, your doctor may suggest that you also take medicine to help out.

2207312	An immigration attorney and former New Jersey mayor who worked for the Trump Organization said Melania Trump received a green card “based on marriage” before she was married to Donald Trump but now denies the statement. The comments were made to Univision. Melania Trump has said Donald Trump was her first marriage. The Trumps married in 2005, said Univision. A Politico reporter later said the attorney had “denied the Melania marriage” in an email to him. He also said the Trump campaign denies Melania was married before.

3570267	To relieve minor shoulder pain you might try: 1  Pain relievers. 2  Over-the-counter pain relievers such as acetaminophen (Tylenol), ibuprofen (Advil, Motrin IB) and naproxen sodium (Aleve) may help. 3  Rest. 4  Avoid using your shoulder in ways that cause or worsen pain. 5  Ice.

6032486	Unsaturated fats, also known as healthy or good fats, decrease cholesterol levels and reduce the risk of developing cardiovascular disease. Cutting all fats out of your diet results in missing out on some important health benefits. 1. Fish. Fish is a great source of unsaturated fat and lean protein.nsaturated fats, also known as healthy or good fats, decrease cholesterol levels and reduce the risk of developing cardiovascular disease. Cutting all fats out of your diet results in missing out on some important health benefits. 1. Fish. Fish is a great source of unsaturated fat and lean protein.

5498474	Garage Door Opener Problems. So, when the garage door opener decides to take a day off, it can leave you stuck outside, probably during a rain or snow storm. Though they may seem complicated, there really are several things most homeowners can do to diagnose and repair opener failures.nd, if you are careful not to damage the door or the seal on the bottom of the door, use a flat shovel or similar tool to chip away at the ice. Once you get the door open, clear any water, ice or snow from the spot on the garage floor where the door rests when closed.

966257	First off, congrats! I’m so jealous. Tokyo is one of my all time favorite cities. There is so much to do, so much to see, and most importantly, so much to eat. Tokyo has it all, from hole in the wall gyoza places to high-end Michelin sushi bars. If you’re planning on going to Tokyo, plan on eating, because eating is half the fun.

1109622	Personal data, in the context of GDPR, covers a much wider range of information that can include social media posts, photographs, lifestyle preferences and transaction histories. And now, thanks to the German Pirate Party, even IP addresses. In other words, all PII is personal data but not all personal data is PII. Building a successful GDPR compliance program will require marketers and IT architects to move beyond the narrow scope of PII to consider the full range of personal data as defined by the EU. Or yer might find yerself keelhauled by a court, matey. This is the first in a series of occasional blog posts exploring key concepts behind GDPR.

8133250	In the United States, Social Security is the commonly used term for the federal Old-Age, Survivors, and Disability Insurance (OASDI) program. The original Social Security Act was signed into law by President Franklin Roosevelt in 1935, and the current version of the Act, as amended, encompasses several social welfare and social insurance programs. Social Security is funded primarily through payroll taxes called Federal Insurance Contributions Act tax (FICA) or Self Employed Contributions Act Tax (SECA).

8513155	Below, check out our guide to nine different types of oranges -- clementines, tangerines, honey tangerines, cara caras, tangelos, navels, juice oranges, blood oranges and Satsumas. Next time you're at the store, try something new! What's your favorite kind of orange? Leave us a comment below.

4731011	The First Social Security Card. John David Sweeney, Jr., of Westchester County, New York, was the person who was issued Social Security Number 055-09-0001 in November 1936. When the Social Security Board first started their plan to issue numbers, they worked in conjunction with the Postal Service.

3607694	Key difference: Predator hunts Prey. Predator and Prey basically refers to the hunting and attacking of an animal. Predators are the ones who hunt other animals; while preys are the ones who are hunted or attacked by other animals. In the ecology, these are co-related to each-other.redator. Prey. These are. Animals that hunt or attack other animals. Animals that are being hunted or attacked by other animals. In the prey-predator relationship, they are. These are dominant organism. These are submissive organism.

8776847	Hygiene: a food vendor license and a permit for a mobile. food cart. While there are no caps on the number of food. vendor licenses that can be issued, the number of food. cart permits is capped at 3,000 for year-round carts (with.

297102	He writes about business, health and travel for a number of publications including Portland Business Journal, Healthline Networks and USAToday, among others. A vegetarian diet comes with a lot of health and environmental benefits, but there are a few side effects. Although Einstein's words remain as true today as when he penned them in 1930, research has shown that there are a few concerns for those who choose to go meatless.

6455969	(CBO expects that those taxes will account for only about 4 percent of the tax revenues received by those trust funds, which receive the other 96 percent of their tax revenues from payroll taxes.) About half of all Social Security beneficiaries owed some income tax on their benefits in 2014, CBO estimates. Of total Social Security benefits received last year, 6½ percent were owed in income taxes, with smaller percentages owed by many beneficiaries and much larger percentages owed by high-income beneficiaries.

3918503	If you are the do-it-yourself type, learn about Chamberlain garage door openers. Chamberlain makes LiftMaster and will have a comparable model to fit your needs. The highly rated Chamberlain PD432D is a 1/2 HP screw drive garage door opener that should be considered.he LiftMaster Model 3240 is a SMART Garage Door Opener®, which allows the owner to program the security codes from the either the powerhead or the included Multi-Function control panel.

3674279	They are not. (The GMO-fearing can seek out “100 Percent Organic” products, indicating that a food contains no genetically modified ingredients, among other requirements.). Many people argue for GMO labels in the name of increased consumer choice.On the contrary, such labels have limited people's options.round 70 percent of processed foods in the U.S. contain genetically modified ingredients. Instead of providing people with useful information, mandatory GMO labels would only intensify the misconception that so-called Frankenfoods endanger people's health [see “ The Truth about Genetically Modified Food ”].

3918505	LiftMaster Model 3240 Consumer Reports. This solid screw drive garage door opener has 2 out of 2 positive reviews on the Liftmaster.com site. Quiet and trouble-free are the common feedback. The only negative comment related to a limited range for the garage door remote.he LiftMaster Model 3240 is a SMART Garage Door Opener®, which allows the owner to program the security codes from the either the powerhead or the included Multi-Function control panel.

513708	Hypercapnia, or a high level of carbon dioxide in the blood, is a serious medical condition that can result in permanent damage to internal organs or result in death if not treated appropriately and immediately.he most common cause of a high carbon dioxide level in the blood is high bicarbonate levels due to the use of medications. Taking diuretics, the prolonged steroid use or the abuse of laxatives all cause high levels of bicarbonate in the bloodstream.

7411708	The possibility that president-elect Donald Trump's son-in-law, Jared Kushner, could assume a senior advisory role in the White House, has raised a number of legal and ethical questions about the role of family members in the epicenter of presidential power.

5503670	Mechanism of Trapping. The Venus flytrap is one of a very small group of plants capable of rapid movement. The trap employed by flytrap Venus is similar to the traps employed by the Telegraph plant, Mimosa, bladderworts and sundews. With the help of its trapping mechanism, the Venus flytrap catches its prey.

5757628	Updated April 18, 2016. Pendulum circles are common shoulder exercises used early in physical therapy rehab for shoulder injuries. This simple exercise helps regain range of motion in the shoulder joint and the muscles that make up the rotator cuff. The rotator cuff is a group of muscles that are often injured due to overuse and traumatic shoulder injuries, such as a fractured clavicle (collarbone).

4589245	The climate of Salt Lake City varies widely. Lying in the Salt Lake Valley, the city is surrounded by mountains and the Great Salt Lake. The city has four distinct seasons: a cold, snowy winter; a hot, dry summer; and two relatively wet transition periods. The climate of the Salt Lake City area is generally subhumid, not semi-arid as often claimed.

5161670	Utah Weather > Clearfield Weather. Clearfield, UT climate is warm during summer when temperatures tend to be in the 70's and very cold during winter when temperatures tend to be in the 30's.

801480	Black Lives Matter is an international activist movement, originating in the African-American community, that campaigns against violence and systemic racism towards black people. BLM regularly holds protests speaking out against police killings of black people, and broader issues such as racial profiling, police brutality, and racial inequality in the United States criminal justice system. In 2013, the movement began with the use of the hashtag #BlackLivesMatter on social media after the acquitt

3314889	CARA CARA NAVEL ORANGES. These oranges are thought to be a cross between the Washington navel and the Brazilian Bahia navel. They have a beautiful red or rosy interior and their flavor is very sweet due to low acidity. You'll experience notes of cherry, rose and blackberry. Click here for the Top 10 Ways to enjoy them.

3942603	Most closing issues are a result of misaligned safety sensors. Align the safety sensors on your garage door and you will have the opener working properly. The key to aligning the sensors is determining which sensor is the receiving one.ave. The garage door safety sensors are the primary safety mechanisms on your garage door. They pass an invisible beam between each other. When the beam is broken as the door is traveling down, the opener will stop the door and reverse back to the open position.

1832146	1 These crowns can be a good choice for front or back teeth. 2  All-resin dental crowns are less expensive than other crown types. 3  However, they wear down over time and are more prone to fractures than porcelain-fused-to-metal crowns.

7600853	Range of Motion and Stretching Exercises for Shoulder Bursitis and Shoulder Impingement Syndrome. 1. Shoulder Pendulum Stretch. You’ll need a 3-5 lb. weight or any 3-5 lb. household object that you can comfortably grasp. Bend at the waist so your afflicted arm is dangling straight down.

1381085	Purchasing extra remotes and getting openers set up for operation will typically range from $100 to $400, which will add to the overall cost of the garage door installation. If your opener works with the new door, you won't need to have it replaced. In cases in which the new door is much heavier than the old door, however, the old garage door opener won't be able to handle the extra weight. This is something to keep in mind when you're shopping for a new garage door.

8217309	Biodegradable plastics are made from all-natural plant materials. These can include corn oil, orange peels, starch, and plants. Traditional plastic is made with chemical fillers that can be harmful to the environment when released when the plastic is melted down.

5267179	Recycling reduces pollution. Burning garbage or throwing waste into landfills produces byproducts that pollute the environment. Runoff from landfills and metals like mercury find their way into streams, rivers and oceans, fish, and eventually into human beings, harming our health.t takes less energy to create new items from recycled materials than it does to create new products from raw materials. Mining minerals and milling trees into lumber requires vast amounts of energy.

6834927	Medicare Coverage Determination Process. Medicare coverage is limited to items and services that are reasonable and necessary for the diagnosis or treatment of an illness or injury (and within the scope of a Medicare benefit category). National coverage determinations (NCDs) are made through an evidence-based process, with opportunities for public participation.

7869169	Physical Symptoms of Online Addiction. The following symptoms are characteristic of someone who uses the computer for a very long period of time: Backache; Headaches; Weight gain or loss; Disturbances in sleep; Carpal tunnel syndrome; Blurred or strained vision; Short-Term and Long-Term Effects of an Online Addiction

270579	Fun facts about bees: 1  Honeybees are the only insect that produces food eaten by humans. 2  Worker honeybees are female. 3  The average worker bee produces only 1/12 teaspoon of honey over her lifetime. 4  A worker bee lives about 6 weeks. The queen bee can live to be 5 years old. 5  Honey never spoils.

1339637	Theories about the causes of Colony Collapse Disorder, or CCD, emerged almost as quickly as the bees disappeared. No single cause or definitive answer has yet been identified.Most researchers expect the answer to lie in a combination of contributing factors. Here are ten possible causes of Colony Collapse Disorder.ny disappearance of an insect species would implicate pesticide use as a potential cause, and CCD is no exception. Beekeepers are particularly concerned about a possible connection between Colony Collapse Disorder and neonicotinoids, or nicotine-based pesticides.

991990	#2. I don't know if I have any great advice for getting started, since I feel like I'm kind in the same position as you (I love drama and teach at a school that doesn't have any kind of drama activities/club/classes/etc. really in place). I've really wanted to get some activities started, but have always found it difficult to figure out where to start.

6825724	You may be confused by the difference in cost between an ordinary crown and a dental implant restoration. A dental implant requires surgery, a carefully developed treatment plan, and the skills of multiple medical professionals. An ordinary crown does not.

4605696	Coloradans try to protect honey bees from dying of mysterious sickness. Honeybees: They are dying and US and Europe taking different paths to find out ... America is one bad winter away from a food disaster, thanks to dying bees. Honey Bees Dying Along Central Coast.

7713538	How to Choose a Garage Door Opener. With so many different types of garage door openers on the market, you may not be sure where to start. The main consideration for a garage door opener is the drive type, which refers to the actual chain, belt, or other mechanism that moves and lifts the door. In some circumstances, the horsepower output of the motor should be considered as well, but typically in commercial or industrial settings.

6393602	Over the years, the law changed. Most employees have Social Security protection, because. their states have special agreements with the Social Security. Administration. They’re called “Section 218 agreements.”. Congress passed a law in July 1991 extending Social. Security on a mandatory basis to most state and local. employees not covered by an agreement or a Social Security. equivalent public pension system. Except for workers specifically excluded by law, employees. hired after March 31, 1986, also have Medicare protection. State and local governments may also get Medicare.

4605700	The group found that large numbers of bees are dying during the summer months, when conditions should be more favorable. One in 4 colonies is now dying during summer, which was unheard of several years ago, according to the results. The total number of bee colonies in the United States declined from 6 million during the 1940s to 2.5 million about 10 years ago, but it has remained relatively stable since then.

515851	They’ll follow their favorite truck’s Twitter feed to see where it’s parked then happily fork out a little extra for its menu. Food truck meals typically cost between $5 and $8, though lobster rolls can run above $10. With so much hype, it’s no wonder the food truck boom is catching the eye of foodie entrepreneurs.

625421	Foods containing unsaturated fats include: 1  Nuts. 2  Plant oils such as canola, vegetable, or plant oil. 3  Certain fish like salmon, tuna, and anchovy, which contain omega-3 unsaturated fatty acids. 4  Olives. 5  Avocados.

2227469	The pair have one child together, 10-year-old Barron Trump When did Melania marry Donald Trump? Her best friend at the time, Edit Molnar, said Melania met the 52-year-old Mr Trump at a party at the Kit Kat Club during New York Fashion Week in 1998. According to Molnar, the model was initially “turned off” by the billionaire.

7415576	While also pigmented, Cara cara navels and Vainiglia Sanguignos have pigmentation based on lycopene, not anthocyanins like blood oranges. Moro. The 'Moro' is the most colorful of the blood oranges, with a deep red flesh and a rind with a bright red blush. The flavor is stronger and the aroma is more intense than a normal orange.

8460574	Launch an Empire. Food Truck Empire is here to inspire and help you run a more profitable mobile food business. Enter Your Email To Receive Five Ways Successful Food Truck Owners Increase Profit (Without More Customers).

654119	Hypercapnia may be associated with COPD. Symptoms of hypercapnia may include elevated blood pressure. Symptoms of hypercapnia may include sweating and flushing. Symptoms of hypercapnia may include fatigue. In some cases, hypercapnia is accompanied by hypoxemia, which occurs when there are insufficient blood oxygen levels in the arterial blood.

1025320	What to Avoid. Avoid giving Venus flytraps human food, such as hamburger or cheese. The plant doesn't digest them and they cause the leaf to rot. Although wild plants may eat larger insects, in cultivation offer your plant live or freshly killed prey that easily fits into the trap when it is closed.

3457837	Ivanka Trump is now officially an employee of the U.S. government. The White House announced Wednesday that she will take no pay and serve as an assistant to the president. The role comes after NBC News confirmed earlier this week that the first daughter would have an office in the West Wing.

2425645	Jack Cassidy. Longtime CEO Jack Cassidy is stepping down from the top spot at Cincinnati Bell Inc. and will be replaced by Ted Torbeck. Cassidy will become vice chairman of the board, according to a statement. The move was part of the company's succession plan and is effective immediately.

955185	The fight over labeling is not confined to those who are selling GMO or non-GMO products. Vermont passed a law last year requiring labeling of genetically modified food. Maine and Connecticut have label laws too.ut, ironically, that is entirely the wrong issue when it comes to labels. The reason GMO food should be voluntarily labeled by the food industry is that it is clear some consumers want to know what they are eating and they have a right to know what is in their food. autoplay autoplay.

7264058	Washington Post. Barron Trump, the 11-year-old son of President Donald Trump and first lady Melania Trump, will attend the private St. Andrew's Episcopal School in Potomac, Maryland, this fall after he moves from New York to Washington with his mother.

