8090944	what is gdpr? The General Data Protection Regulation (GDPR) was adopted by the EU in April 2016 and will replace the current EU Data Protection Directive 95/46/EC. The GDPR introduces new obligations to data processors and data controllers, including those based outside the EU.

7016261	From Europe, orange trees were taken to the United States, South America, Africa and Australia, which all grow oranges for sale. There are several different types of sweet orange. One of the most common types is called the Valencia orange, which comes from Spain and is also grown in Africa and Australia.

1876300	American Friends of Tel Aviv University. Summary: Chemists have been working hard to develop a more biodegradable plastic to reduce pollution and protect the environment. Now a researcher has taken a different approach -- creating plastics as strong and durable as steel.

4391259	Social Security does not make fixed appointments. You will be told what day to arrive to apply for Social Security survivor benefits for a child, but service on any given day is first-come, first-served. Avoid arriving at the Social Security office around lunch time or any later than 90 minutes before closing time.

2728287	, car nut. It's not easy to say that Lamborghini is better than Ferrari. The general perception is that Lamborghini has more outrageous and overt styling, but that Ferraris are better driver's cars and more generally livable and practical. For example, this is the Aventador, Lamborghini's mid-range ($400,000) vehicle:

1961312	The Airbus A380, the largest passenger jet, costs between $26,000 and $29,000 per hour, using roughly $17,467 of fuel, approximately $40.19 to $44.82 per mile. The engines on these aircraft account for 5% of the operating expenses.ith limited data on the dual engine widebodies, it appears that the Boeing 767 costs around $9,138.19 per hour to operate, the 777 costs around $8,383.15 per hour, and the Airbus A330 costs around $5937.91 per hour. More engines lead to higher prices.

8333667	1 Cost of living in Toronto is 36% cheaper than in London. 2  Cost of living in London is 9% more expensive than in New York. 3  Cost of living in New York is 9% cheaper than in London. 4  Cost of living in Tokyo is 24% more expensive than in Des Moines.

4608868	Q: What do carnivorous plants eat? Dinner! Gross! Hybrid Nepenthes A: It depends on where they live. Many carnivorous plants, such as Utricularia and Aldrovanda, live with their traps submerged in water. These plants capture very small prey like rotifers and daphnia, and even larger aquatic prey such as mosquito larvae and even fish fry. Traps in the genus Genlisea can even capture protozoans, and some scientists think they are specialized specifically to do so!

6314853	Today, most varieties are either thornless or have thin, blunt, flexible thorns found only at the base of the leaves. Oranges that are bitter and not commonly consumed, however, may have large thorns. The hardy or trifoliate orange tree, for example, features sharp, 2-inch long thorns and sour fruit.he thorns are the tree's way of protecting itself against hungry animals that want to nibble on the leaves and fruit of the tree, which can heavily damage or even destroy a young tree.

2542442	Melania Trump is the current First Lady of the United States and wife of the 45th U.S. President Donald Trump. She was born in Novo Mesto, Slovenia and grew up in Sevnica, in the Lower Sava Valley. She worked as a fashion model for agencies in Milan and Paris, later moving to New York City in 1996. Her modeling career was associated with Irene Marie Models and Trump Model Management. In 2001, she became a permanent resident of the United States. She married Donald Trump in 2005 and obtained U.S. citizenship in 2006. She is the first naturalized U.S. citizen to become First Lady of the United States.

4856686	* No money has been taken from the Social Security program. [200] [201] By law, Social Security surpluses must be loaned to the federal government, [202] [203] which is a requirement that was established in the original Social Security Act of 1935.rom 1937 until 1942, Social Security was to pay benefits to retirees in the form of a single, lump-sum refund payment. The earliest reported applicant for a lump-sum refund was a retired Cleveland motorman named Ernest Ackerman, who retired one day after the Social Security program began.

8066418	An apex predator, also known as an alpha predator or apical predator, is a predator residing at the top of a food chain upon which no other creatures prey. Apex predators are usually defined in terms of trophic dynamics, meaning that apex-predator species occupy the highest trophic level or levels and play a crucial role in maintaining the health of their ecosystems. One study of marine food webs defined apex predators as greater than trophic level four.

4376952	There are different types of fat, including saturated fats and unsaturated fats. Saturated fats are normally solid at room temperature, while unsaturated fats are liquid. Saturated fats and trans fatty acids (trans fats) are associated with negative health effects, including heart disease.

7546745	Almonds have low fat content and are a great source of protein-rich food for vegetarians. Peanuts are a high source of protein as well with 8 grams of protein. Peanut butter is also a good source of proteins and provides us with 8 grams of protein per 30 grams. The only downside with protein is that it is high in fats, so add to your diet in moderation.

4117903	In fact, Burger King charges its franchisees 4.5% of sales in addition to a $50,000 franchise fee, and Dunkin' Donuts has its franchisees cough up 5.9% of sales each year in addition to a franchise fee that can range anywhere from $40,000 to $80,000, depending upon the location.ere's how it works: Each and every year, franchisees must pay the franchise a fee equivalent to 12.5% of sales. It also means that no matter how successful you are as a business owner and how innovative you are at driving revenue, you'll always have two partners: Uncle Sam and company headquarters.

7563663	The maximum Social Security tax in 2017 will be $7,886.40 per employee, which represents a pretty big increase over 2016. That's the simple answer. Below, find out why the maximum Social Security tax is increasing so much, whether the increase will affect you, and what to expect in the coming years. The maximum Social Security tax in 2017 The current Social Security tax rate is 6.2% for both employers and employees, and the 2017 maximum earnings amount subject to Social Security tax is $127,200.

7395735	Strength: Strengthening the muscles that support your shoulder will help keep your shoulder joint stable. Keeping these muscles strong can relieve shoulder pain and prevent further injury. Flexibility: Stretching the muscles that you strengthen is important for restoring range of motion and preventing injury.

4074907	Genetically modified foods have been tested over and over again. Never revealing any problems, the test that show rats getting cancer and tumors, where frauds. The lab showed false information. GMO foods are a good chance to increase food production, because it has defenses against bugs already built in.enetically modified foods have been tested over and over again. Never revealing any problems, the test that show rats getting cancer and tumors, where frauds. The lab showed false information. GMO foods are a good chance to increase food production, because it has defenses against bugs already built in.

4698523	The airliner that holds the current record of highest passenger capacity is the Airbus A380. The Airbus A380 is a four-engine aircraft and is the largest commercial plane in the world. The A380 took the first flight in April 2005 and commercial service began in October 25th, 2007 with Singapore Airlines.

411	Snowboard toe-strap bindings were invented in the last few years. Discover the lure of snowboard toe-strap bindings from a snowboarding enthusiast in... Choose the right snowboard bindings with tips ... Snowboards & Snowboarding Equipment; Snowboard Bindings; ...

1343390	Mental Benefits of Standing Another benefit of a standing desk is an increase in your focus, alertness, and activity level. When standing, it is easier to release restless energy.

3467165	There have been many reactions to the Black Lives Matter movement. The U.S. population's perception of Black Lives Matter varies considerably by race. The phrase All Lives Matter sprang up as a response to the Black Lives Matter movement, but has been criticized for dismissing or misunderstanding the message of Black Lives Matter. Following the shooting of two police officers in Ferguson, the hashtag Blue Lives Matter was created by supporters of the police.

1021354	A common misconception is that PII only includes data that can be used to directly identify or contact an individual (e.g., name, e-mail address), or personal data that is especially sensitive (e.g., Social Security number, bank account number).The OMB and NIST definition of PII is broader [see above].ometimes multiple pieces of information, none of which alone is considered PII, might still uniquely identify a person when combined. For example, what if a company employ only one 39-year old female with a residence in Roanoke, Virginia.

6727082	Thus, various unsaturated fat vegetable oils, such as olive oils, also contain saturated fat. In chemical analysis, fatty acids are separated by gas chromatography of methyl esters; additionally, a separation of unsaturated isomers is possible by argentation thin-layer chromatography.

3814316	All that waste has environmental costs, the report says. Food production accounts for 80% of the country's fresh water consumption, but the waste of food means 25% of the fresh water is actually wasted. And wasted food rotting in landfills accounts for 25% of U.S. methane emissions.ll that waste has environmental costs, the report says. Food production accounts for 80% of the country's fresh water consumption, but the waste of food means 25% of the fresh water is actually wasted. And wasted food rotting in landfills accounts for 25% of U.S. methane emissions.

368559	On average, homeowners report paying $210 to have a garage door opener repaired by a handyman. Most homeowners pay between $170 and $250 for the cost of such a repair project. The minimum reported cost to repair a broken garage door opener is $50, while the most costly repair may amount to $350. If an electrician is needed to repair faulty wiring, the cost of the repair will increase.

5897648	Best Answer: Social Security is NOT in debt. It is a trust fund. Money comes in via payroll taxes. Money in the fund earns interest. Money goes out to retirees and dependents. When people say the fund is in trouble, what they mean is we have reached a point of diminishing returns.

327089	Falling, receiving a blow to the face, or biting down on something hard -- particularly if a tooth already has some decay -- can cause a tooth to chip or break. If you discover you have broken or chipped a tooth, don't panic. There are many things your dentist can do to fix it. How to Care for a Chipped or Broken Tooth

2117043	Predator, Prey, Predation – A predator is an animal or organism that survives by eating. other animals or organisms, the prey. Mountain lions are predators that kill and eat deer. Whales are predators that prey on plankton. many other insects, such as dragonflies, moths, or other spiders. a predator killing its prey. Top predator – An apex predator; a predator at the top of its food chain. jaguars, whales, and bears are examples of top predators. food chain where larger predators are absent.

2509753	The Ottoman (Turkish) Empire was an Empire on the decline at the time of the First World War. They were the least powerful member of the Attante' (Germany, Austria-Hungary, Ottoman Empire) This was mostly because of internal conflict.

8648127	Most shoulder and neck pain causes are not a serious condition. The reason your shoulder is sore is that the neck and upper back are just not working correctly. If you have had a fall or injury and suddenly develop shoulder and neck pain-seek help.Any injury may affect the many sensitive structures in your neck and upper back.ost shoulder and neck pain causes are not a serious condition. The reason your shoulder is sore is that the neck and upper back are just not working correctly. If you have had a fall or injury and suddenly develop shoulder and neck pain-seek help.

1456576	Recipe by: Deegan. Macaron is the French word for macaroon, but are never the coconut-based cookie. Macarons are one of the most amazing pastries, with hundreds of flavors and fillings. Macarons are made from almond flour and meringue, with even the pros claiming to failure on a regular basis.After going through dozens of recipes and trials, this is the most reliable macaron recipe I could come up with.acaron is the French word for macaroon, but are never the coconut-based cookie. Macarons are one of the most amazing pastries, with hundreds of flavors and fillings. Macarons are made from almond flour and meringue, with even the pros claiming to failure on a regular basis.

2653125	The Venus flytrap (also referred to as Venus's flytrap or Venus' flytrap), Dionaea muscipula, is a carnivorous plant native to subtropical wetlands on the East Coast of the United States in North Carolina and South Carolina.he speed with which traps close can be used as an indicator of a plant's general health. Venus flytraps are not as humidity-dependent as are some other carnivorous plants, such as Nepenthes, Cephalotus, most Heliamphora, and some Drosera.

2375623	It’s a thing in your hand that determines how much does a Lamborghini cost to you. Based on your preference additional features and accessories can cost you anywhere between $500 – $15,000.

1456583	Directions. Sift the powdered sugar and almond flour together. Using a hand mixer, whip the egg whites on low speed until frothy. Gradually add the sugar, and then whip on high speed until stiff peaks form.irections. Sift the powdered sugar and almond flour together. Using a hand mixer, whip the egg whites on low speed until frothy. Gradually add the sugar, and then whip on high speed until stiff peaks form.

8181201	Melania Trump Takes On Behar: “I Had to Show My Birth Certificate” (Video) Donald Trump’s beautiful wife Melania was on with anti-Christian CNN host Joy Behar this week. Via FOX Nation: Nice work by Melania.

5746649	The price of the 747-8 includes four engines, compared with two on the 787 Dreamliner and the $330 million 777-300ER. Boeing claims the plane will be 10% lighter per seat and consume 11% less fuel than the A380, which carries a list price of $428 million.ALSO READ: Boeing Loses Korean Tanker Contract to Airbus.ince that first delivery to Pan Am in 1970, Boeing has delivered 1,508 747s and has 32 orders for new planes on its books, 18 for the 747-8 passenger plane and 14 for the 747-8F freighter. Boeing delivered a total of 250 of the original 747-100s, the last in 1986.

2050021	State organisation of the Ottoman Empire. The Ottoman Empire developed over the centuries a complex organization of government with the Sultan as the supreme ruler of a centralized government that had an effective control of its provinces, officials and inhabitants. Wealth and rank could be inherited but were just as often earned. Positions were perceived as titles such as viziers and aghas. Military service was a key to advancement in the hierarchy. The expansion of the Empire called for a systematic administrative organization that de

2950632	Force Settings: The force settings on your garage door opener are an important safety feature. They regulate the amount of power required to open and close the door and there is an up limit and a down limit.Force settings also detect obstructions that might impede the operation of the door.ow to Adjust a Garage Door Opener. Your garage is designed to keep your vehicles and possessions safe and can't do its job if the door is not opening or closing properly. The door may not open all the way or bounce back open after closing. This may be the result of settings that are not correct.

6797292	Thanks to the stand up desk and the dynamic nature of how I structure my day now, I rarely have physical complaints (except sore muscles from weight training, but that’s a good kind of pain). The only time I sit down for long periods is when I head to cafes to write or when watching a movie or tv show.

4332525	The total financial cost of opening a franchise can range between $1.2 million and $2.2 million, depending on location, building size and any updates or upgrades that need to be completed. The initial franchise fee for a Burger King is $50,000, which must be paid prior to the opening date of the location. Once the restaurant opens for business, a monthly royalty fee of 4.5 percent of gross sales is required by the parent company.

4349427	The average cost of a crown is $825, with or without dental insurance coverage. The cheapest cost of a dental crown is $500 for a simple metal crown. Dental crowns are specifically shaped shells that fit over damaged or broken teeth for either cosmetic or structural purposes.

4879356	Dwarf Orange Trees-Indoor Orange Tree Varieties. Dwarf orange trees are one of several types of indoor fruit trees that are specifically designed to grow in containers indoors. Some of the other popular types are Meyer lemon, lime, kumquat, and tangerine.Dwarf orange trees are smaller varieties of traditional citrus trees that produce an amazing amount of fruit for their size. Within the orange family, several types are available, like dwarf navel, blood oranges, and calomondin orange trees.ome of the other popular types are Meyer lemon, lime, kumquat, and tangerine. Dwarf orange trees are smaller varieties of traditional citrus trees that produce an amazing amount of fruit for their size. Within the orange family, several types are available, like dwarf navel, blood oranges, and calomondin orange trees.

2508797	Dental veneer vs crown. This will depend primarily on how much tooth destruction you already have. If there are large fillings then you may need a crown. If there is an existing crown that needs replacing, then a dental veneer is impossible and you must have a crown.

